{"administrative_independence":false,"checks":{"action_digest_preserved":true,"artifact_digest_preserved":true,"linux_capabilities_are_dropped":true,"new_import_stopped_after_withdrawal":true,"origin_has_no_host_ports":true,"origin_preflight_passed":true,"origin_secrets_are_scoped":true,"private_network_is_internal":true,"real_lease_expiry_pruned_entry_and_blob":true,"receiver_preflight_passed":true,"receiver_secret_is_scoped":true,"result_digest_preserved":true,"role_root_filesystems_are_read_only":true,"roles_run_as_non_root":true,"secret_scan_passed":true,"tls_import_succeeded":true,"unexpired_receiver_copy_survived_withdrawal":true,"untrusted_peer_denied":true,"untrusted_secret_is_scoped":true,"withdrawal_manifest_is_empty":true},"container_runtime":"Docker Desktop Linux containers","date":"2026-08-24","environment_kind":"simulated","ephemeral_test_secrets_destroyed":true,"image_reference":"[{\"ID\":\"sha256:5fe8167a2bf9653c0d3a0646bd7c23cffe0a562850f586e01104871bb95a2c2b\",\"ContainerName\":\"oncemesh-m3-sim-origin_initial-1\",\"Repository\":\"oncemesh-federation-sandbox\",\"Tag\":\"local\",\"Platform\":\"linux/amd64\",\"Size\":54817159,\"LastTagTime\":\"2026-08-24T15:52:11.928709028Z\"}]","limitations":["One host operator controls every container, secret, network, and artifact.","TLS uses an ephemeral private test CA rather than a managed certificate.","Replay and rate-limit state remain local to one origin process.","This report cannot satisfy independent organizational governance or key custody."],"metadata":{"action_digest":"sha256:89254972caeb3508d5208b2dbf482d59555bee3e0a5a26b361a0cd1fb66d0e55","artifact_bytes":31,"artifact_digest":"sha256:3c7a22733c47731430e06a8c7d01db1e7e626d2aaa80c1929b3a9760b4f9065f","result_digest":"sha256:441ecbfe43b76082a25a842083a9732208841de8431c41544c1a47ca0087680e"},"passed":true,"scenario_id":"m3-three-role-container-v0","secret_scan":{"matches":0,"passed":true,"scanned_needles":5},"spec_version":"oncemesh.federation-simulated-acceptance-report/v0"}
